Query,JD
Maintenance Technician,"<div>\r<p align=""center"">Maitenance Technician - Day Shift<br>\r<br>\r</p>\r<p style=""text-align: center""><span>a?¡é??</span><span>MONDAY THROUGH FRIDAY POSITION</span></p>\r<p style=""text-align: center""><span>??</span></p>\r<p style=""text-align: center""><span>a?¡é??</span><span> WILLING TO ACCOMMODATE OVERTIME EXPECTATIONS</span></p>\r<p style=""text-align: center""><span>??</span></p>\r<p style=""text-align: center""><span>The Step2 Company,</span><span></span><span>LLC </span><span>is a multinational manufacturer and marketer of high quality plastic products for children and for the home and garden. The company has two plants, located in Perrysville and Streetsboro, Ohio. The Perrysville Plant has an opening for a day shift maintenance technician. The maintenance technician is a key role reporting to the Maintenance Manager. Candidate will be performing a wide variety of maintenance including machinery repair, electrical, hydraulic, troubleshooting, building and preventative maintenance. The ideal candidate will have three to five years experience in a hands on maintenance position in a manufacturing environment, with a heavy emphasis in electrical repairs, who can consistently work under minimal supervision. </span></p>\r</div>"
Financial Analyst,"<p>Job Title: Financial Analyst<br />\r<br />\rJob Description:</p>\r<p>The Sr. Financial Analyst is responsible for supporting management reporting, budgeting, forecasting and analysis for the Global Supply Chain organization (or sub-organization) to measure the health of operations relative to goals, targets and budgets.</p>\r<p></p>\r<p>Specific duties will include: compilation of the annual budget, monthly forecasts, monthly reporting package, variance analysis, dashboard reporting and ad-hoc analysis to provide decision support for senior leadership.<br />\r<br />\rRequirements:</p>\r<ul>\r    <li>Functional understanding of SAP R/3 (General Ledger, Fixed Assets, Materials Management, Material Ledger)</li>\r    <li>Functional understanding of SAP Business Warehouse (Finance, Supply Chain, Sales & Distribution)</li>\r    <li>Advance skills in MS Office Suite (advanced knowledge of Excel including pivot tables, vlookups, and modeling) and proficiency in Access, SQL and PowerPoint Understanding of variance analysis and financial performance monitoring.</li>\r    <li>Ability to concisely summarize the results of financial analysis, explain the meaning and implications in varying levels of detail depending on the audience.</li>\r    <li>Strong accounting, analytical, business partnering skills with a high degree of accuracy and ability to meet deadlines. Strict attention to detail and intensity around consistently delivering high quality outputs.</li>\r</ul>"
Sales Representative,"<center><strong>SALES REPRESENTATIVE</strong></center><br />\r<br />\r<strong><em>Are you hungry to make that sale? <br />\rAre you looking for a career that offers a base salary plus unlimited earning potential?</em></strong> <br />\r<br />\rIf so, we have the position for you! <br />\r<br />\rSelect Staffing is adding to its talented sales team in your area! While maintaining a strong client base, you will be able to expand your territory with new prospects. The opportunities are endless! <br />\r<br />\r<br />\r<strong>Responsibilities:</strong> <br />\r<ul>\r    <li>Prospecting and generating leads through in-person and telephone cold-calling </li>\r    <li>Monitor and research the workforce to achieve optimal productivity and output from potential business and current clients </li>\r    <li>Developing and executing effective marketing/sales campaigns to prospects </li>\r    <li>Ultimately, impacting the clients business by increasing productivity and decreasing costs by selling Select Staffinga??s recruitment strategies, thata??ll meet your client's unique needs </li>\r    <li>Maintaining, servicing and growing our existing client database </li>\r    <li>Actively participating in local networking organizations </li>\r    <li>Acting as a liaison between our customers and Personnel Supervisors who continually service your accounts </li>\r    <li>Maintaining effective documentation and tracking sales activity, in company software system </li>\r    <li>Responsible for conducting weekly meetings with the client to maintain top of the mind knowledge of the client's business, current opportunities and challenges, and workforce requirements </li>\r</ul>\r<br />\r<br />\r<strong>Qualifications:</strong> <br />\rOur ideal candidate will possess the following: <br />\r<ul>\r    <li>A proven sales ability with success at building relationships and creating customer loyalty </li>\r    <li>Experience selling a service versus a tangible product a plus </li>\r    <li>Territory and account management skills with proven competency in account penetration and time management </li>\r    <li>Experience in the Staffing industry is preferred </li>\r    <li>Exceptional communication </li>\r    <li>Strong customer service orientation </li>\r</ul>\r<br />\r<br />\rSelect Staffing offers competitive compensation packages, great benefits, and an enjoyable work atmosphere. <br />\r<br />\rApply today to join the Select Family!"
Senior Accountant,"<b>Responsibilities:</b> This position will work the Healthcare Consultant and be responsible in areas including financial, regulatory, revenue cycle, compliance, and similar topics that span the healthcare industry. You must be willing to work on various projects and be team oriented.\r\n\r\nFunctions Include:\r\n<UL><LI>Manipulate and scrub data</li>\r\n<li>Be strong technically; an Excel 'Guru'</li>\r\n<li>Test software</li>\r\n<li>Work with various test plans</li>\r\n<li>Prepare reports</li>\r\n<li>Travel (2-4 day stints)</li>\r\n<li>This person will come from the Revenue Cycle</li>\r\n<li>Billing</li>\r\n<li>Systems experience</li>\r\n<li>Patient accounting</li>\r\n\r\n</ul>\r\nPrimary Responsibilities:\r\n<UL><LI>Consulting with Hospital Business Offices working with the Controller, Director, or VP of Patient Revenue Cycle</li>\r\n<li>Report to state 'unclaimed accounts' which is where the unclaimed property experience comes in (this experience does not necessarily have to come from healthcare)</li>\r\n<li>Gather patient files and audit / analyze files looking for inefficiencies</li>\r\n</ul>\r\n\r\nKforce (Nasdaq:KFRC) is a professional staffing and solutions firm providing flexible and permanent staffing solutions in the skill areas of technology, finance & accounting, clinical research and healthcare. Backed by approximately our associates and consultants on assignment, Kforce is committed to ""Great People = Great Results"" for our valued clients and candidates. Kforce operates with 65 offices located throughout the United States and two offices in the Philippines.\r\n\r\nJob Ref#: 2312~EQG~1108865P1~99"
Maintenance Technician,"<p>CBRE Group, Inc. (NYSE:CBG), a <em>Fortune</em> 500 and S&P 500 company headquartered in Los Angeles, is the world's largest commercial real estate services firm (in terms of 2010 revenue).\r\n The Company has approximately 31,000 employees (excluding affiliates), and serves real estate owners, investors and occupiers through more than 300 offices (excluding affiliates) worldwide. CBRE offers strategic advice and execution for property sales and leasing; corporate services; property, facilities and project management; mortgage banking; appraisal and valuation; development services; investment management; and research and consulting. Please visit our Web site at <a href=""http://www.cbre.com/"">www.cbre.com</a>.</p>\r\n<p>\r\n<p>\r\n<p>Our Global Corporate Services group delivers customized, innovative workplace solutions worldwide. Strategically positioned to answer our corporate, healthcare, government and institutional clients' real estate needs, this group combines unrivaled expertise in transaction services, facilities and project management and consulting with industry-specific expertise and global service delivery to provide clients with long-term, quality account management.</p>\r\n</p>\r\n<p>Responsibilities:\r\n\r\n<p>JOB SUMMARY </p>\r\n<p>Performs general maintenance of assigned facilities utilizing several trade skills such as carpentry, plumbing, electrical, painting, roofing, heating and cooling.\r\n\r\n</p>\r\n<p>ESSENTIAL DUTIES AND RESPONSIBILITIES include the following:</p>\r\n<p>Performs day-to-day repairs, emergency maintenance, and preventative maintenance on several assigned properties or accounts.</p>\r\n<p>Receives work orders for corrective repair work on a variety of building physical structures, equipment, and system components. Prepares estimates detailing the amount of time and materials needed for completing tasks. Orders the necessary materials in order to complete all necessary repairs. Finalize work orders by completing necessary paperwork.</p>\r\n<p>Assist with troubleshooting and repairs of buildings and installed systems to include: packaging and handling machinery, plumbing systems, kitchen equipment, roofs, drains, shop, grounds equipment and HVAC.</p>\r\n<p>Assist with installation and modification of building equipment systems.</p>\r\n<p>Inspect new installation for compliance with building codes and safety regulations. Comply with all applicable codes, regulations, governmental agency and Company directives as related to building operations and practice safe work habits.</p>\r\n<p>Performs carpentry and snow removal when necessary.</p>\r\n<p>Participates in moving and installing furniture for office relocations.</p>\r\n<p>Understand an electrical panel schedule and troubleshoot minor electrical problems.</p>\r\n<p>Able to change lighting ballasts and bulbs.</p>\r\n<p>Must be knowledgeable of ladder and lift safety.</p>\r\n<p>Other duties may be assigned.</p>\r\n<p>&nbsp;</p>\r\n<p>SUPERVISORY RESPONSIBILITIES </p>\r\n<p>Provides informal assistance such as technical guidance and/or training to co-workers.</p>\r\n</p>\r\n<p>&nbsp;</p>\r\n</p>\r\n\r\n<p>Qualifications:\r\n<p>To perform this job successfully, an individual must be able to perform each essential duty satisfactorily. The requirements listed below are representative of the knowledge, skill, and/or ability required. Must be a self-starter, good-time management skills, team player, reliable personal transportation.\r\n Reasonable accommodations may be made to enable individuals with disabilities to perform the essential functions.</p>\r\n<p>EDUCATION and EXPERIENCE </p>\r\n<p>High school diploma or general education degree (GED) and one to two years of related experience and/or training.</p>\r\n<p>CERTIFICATES and/or LICENSES </p>\r\n<p>HVAC Certification or</p>\r\n<p>MinimumTwo Year Mechanical Trade Schooldegree</p>\r\n<p>\r\nCOMMUNICATION SKILLS </p>\r\n<p>Ability to comprehend instructions, short correspondence, and memos and ask clarifying questions to ensure understanding. Ability to write simple correspondence. Ability to effectively present information to co-workers and/or supervisors on a one-on-one basis.</p>\r\n<p>FINANCIAL KNOWLEDGE </p>\r\n<p>Requires no knowledge of financial terms and principles.</p>\r\n<p>REASONING ABILITY </p>\r\n<p>Ability to solve problems involving several options in situations. Requires intermediate analytical and quantitative skills.</p>\r\n<p>OTHER SKILLS and/or ABILITIES </p>\r\n<p>Must be able to use a PC for reviewing e-mail and accessing the Internet to order materials.</p>\r\n<p>SCOPE OF RESPONSIBILITY </p>\r\n<p>Decisions made with general understanding of procedures and company policies to achieve set results and deadlines. Errors in judgment may cause short-term impact to co-workers and supervisor.</p>\r\n<p>\r\nDISCLAIMER </p>\r\n<p>This job description has been designed to indicate the general nature and level of work performed by employees within this classification.\r\n It is not designed to contain or be interpreted as a comprehensive inventory of all duties, responsibilities and qualifications required of employees assigned to the job.</p>\r\n</p>\r\n<p>\r\n<p>To be considered for a position with CBRE, please apply online at http://cbre.com/careers.\r\n Click on a??Search and Applya?? on the left side of the screen.\r\n If a pop-up window does not open, please check your browser's settings.\r\n On the login window either login with your existing username and password or click on a??Register Todaya?? to create one.\r\n Once you are logged in you can either apply for specific jobs or submit your general application using the link at the bottom of the page.\r\n\r\nCurrent CBRE employees should apply online through the myHR section of Employee Self Service.\r\n\r\nEOE & AA Employer M/F/D/V</p>\r\n</p>"
Physical Therapist,"<p>Signature HealthCARE is interviewing for a full-time Physical Therapist for our Sunrise Manor Nursing Home located in Hodgenville, KY.<br>\r<br>\r</p>\r<p>Sunrise Manor is a BRAND NEW 137 bed facility with private suites &amp; semi-private rooms. Our new facility has a 3,200 square foot state-of-the-art therapy gym with all new equipment. <br>\r<br>\r<br>\r</p>\r<p>Signature HealthCARE LLC believes in qualify of life initiatives &amp; embraces therapists that are innovative and think outside of the box. Our three pillars are Spirituality, Education &amp; Intra-preneurship. We are an in-house, spiritually based organization with competitive benefits. We believe in treating the patient, not the payer source. If you have time, I also encourage you to visit our company website <a href=""http://www.signaturehealthcarellc.com/"">www.Signaturehealthcarellc.com</a> to read about our vision and mission for radically changing Long Term Care!&nbsp; <br>\r<br>\r</p>\r<p>Signature HealthCARE LLC is a Long Term Care company with over 70 facilities in AL, GA, FL, KY, MD PA, and TN.&nbsp; Signature HealthCARE is founded on the belief that enhancing quality of life for the aging of America is essential. Humanity and dignity are achievable, and our nation's elderly population deserves the attention and commitment of dedicated, compassionate care providers like you!&nbsp; Spirituality, learning &amp; Intra-preneurship are the organizational pillars of Signature HealthCARE and form the foundation of our commitment to revolutionize Long Term care in the U.S. <br>\r<br>\r<br>\rBenefits include:<br>\r&bull;&nbsp;Medical/Dental/Vision benefits Starts the 1st of the Month after 31 days of employment. <br>\r&bull;&nbsp;FREE medical insurance for the employee! <br>\r&bull;&nbsp;Basic Life Insurance &ndash; $20,000 &ndash; no cost to employee! <br>\r&bull;&nbsp;Supplemental Life &ndash; optional <br>\r&bull;&nbsp;Short Term Disability &ndash; Paid by Company! <br>\r&bull;&nbsp;Long Term Disability available through MetLife <br>\r&bull;&nbsp;Home, Auto &amp; Pet Insurance- triple discount through MetLife <br>\r&bull;&nbsp;401K Matching 25 cents on the dollar up to 3% of annual salary <br>\r&bull;&nbsp;Flexible Spending Accounts &ndash; up to $1,500 annually for Health &amp; $5,000 for Child Care <br>\r&bull;&nbsp;Continuing Education Reimbursement <br>\r&bull;&nbsp;Vacation &amp; Holiday pay for full-time &amp; part-time employees<br>\r&bull;&nbsp;Tuition Reimbursement <br>\ro&nbsp;Gold, Silver &amp; Platinum Survey Award/Bonuses <br>\ro&nbsp;ParnterPerks Program<br>\ro&nbsp;Compassion Fund<br>\ro&nbsp;Employee Referral Bonus Program<br>\ro&nbsp;In-house rehab at all facilities</p>\r<p>For more information, please contact Amy Brashear, 800-640-1935 or at <a href=""mailto:abrashear@signaturehealthcarellc.com"">abrashear@signaturehealthcarellc.com</a> or visit our website at <a href=""http://www.signaturehealthcarellc.com/"">http://www.signaturehealthcarellc.com/</a><br>\r&nbsp;</p>"
Receptionist,"<p style=""text-align: justify;"">John Casablancas Modeling and Career Centers is a leading international company in the modeling, acting, and personal development training industry.?? We strive to provide high quality training services through value-added and innovative initiatives while keeping our proud traditions in the fields of modeling, acting, and personal development.</p>\r<p style=""text-align: justify;"">While our mission is to enroll the maximum number of students that can benefit from our training and offer them the best education possible we recognize that our employees are the competitive advantage.?? We will deliver the resources to be winners, to support the growth and profitability of the Company, while preserving the values and special culture of John Casablancas Modeling and Career Centers.</p>\r<p style=""text-align: justify;"">John Casablancas Modeling & Career Centers offers unlimited opportunities for individuals seeking upper management or entrepreneurial opportunities.?? Currently, the average length of service for our managers is 11 years!???? The Company currently has offices in 40 cities throughout the world and is always looking to expand.?? If high levels of production are maintained, and a positive attitude with leadership qualities are demonstrated then an employeea??s options grow exponentially.?? Employees, who demonstrate these qualities and skills have the potential to become a supervisor, open a new JC Center for the Company or become a JC Owner!?? </p>\r<p style=""text-align: justify;"">??<br />\r<b><span style=""text-decoration: underline;"">Job Summary:</span></b></p>\r<p style=""text-align: justify;"">The Receptionist is a pivotal part of the success of our Centers.?? This position helps to coordinate and facilitate the activities of the staff and students.?? This position is responsible for all incoming traffic; mail, phones, walk-ins as well as communication with the staff.?? In addition, the Receptionist is responsible for checking in students, collecting any tuition payments, rescheduling missed classes as well as any other administrative functions that are deemed necessary.</p>"
Store Manager,"<b><center>Store Manager</b><p>\r\nLive up to your full potential.</center>\r\n<p>Are you looking for a rewarding management opportunity?  We are currently seeking experienced, enthusiastic, career-minded <b>Store Managers</b> to join our team.  If you have superior leadership skills, operational excellence and can increase sales and profitability while managing a dynamic sales team, this could be the position for you!\r\n\r\n<b>\r\n \r\n<strong>Job Functions / Duties / Responsibilities :</strong> ??\r\n\r\nResponsibilities: \r\n\r\na?¡éBuild a loyal customer base by creating long-term relationships \r\n\r\na?¡éAchieve or exceed sales and profit targets \r\n\r\na?¡éManage the storea??s controllable categories on the storea??s profit and loss statement \r\n\r\na?¡éAchieve personal sales and profitability goals \r\n\r\na?¡éRecruit, hire, and retain top tier talent \r\n\r\na?¡éManage the day to day operations of the business  \r\n\r\na?¡éCoach and counsel associates  \r\n\r\na?¡éOther duties as needed\r\n\r\n<b>"
Java Developer,"<p><b><span>TATA Consultancy Services (TCS)</span></b><span> is currently searching for a <b>Java Developer</b> to join their team (<b>near Chicago, IL)</b>.&nbsp; TATA Consultancy Services (TCS) is one of the world's leading information technology companies. Through its Global Network Delivery Model&trade;, Innovation Network, and Solution Accelerators, TCS focuses on helping global organizations address their business challenges effectively. </span></p>\r<p>&nbsp;</p>\r<p><b><span>JOB SCOPE:</span></b></p>\r<ul>\r    <li>Construction using design specifications\r    <li>Communicating with Designers\r    <li>jUnit Testing\r    <li>Excellent Communication\r    <li>Good analytical skills\r    <li>Ability to work in multi-cultural teams\r    <li>Good interpersonal skills </li>\r</ul>"
Receptionist,"<p><span>Join Wisconsina??s #1 Automotive Retailer, Bergstrom Automotive!???? </span></p>\r<p></p>\r<p><span>If you like working with people and being a part of a team join our Used Car Superstore and Body Shop Oshkosh team.?? If you are dependable, detailed, and guest service orientated then Bergstrom is the place for you!?? Duties include answering and transferring phone calls and greeting our guests.?? </span></p>\r<p></p>\r<p><span>As a part of the Bergstrom team you enjoy:</span></p>\r<ul>\r    <li><span>Job Security</span>\r    <li><span>Competitive Wages</span>\r    <li><span>Fun work environment</span>\r    <li><span>Advancement Opportunities</span> </li>\r</ul>\r<p></p>\r<p><span>Stop in to fill out an application today or send your resume to: </span></p>\r<p></p>\r<p><span>Email: <a href=""mailto:resume@bergstromauto.com"">resume@bergstromauto.com</a></span></p>\r<p></p>\r<p><span>EOE M/F/H/V</span></p>"
Cashier,"<b> <center> <hr>\rCashier</center></b><center> </center> <hr>\r<br />\r<br />\r<b><span style=""text-decoration: underline"">Company Profile </span></b><span style=""text-decoration: underline""> </span>\r<br />\r<br />\rSapp Bros Truck Stops was started by the four Sapp brothers in Omaha at the junction of 1-80 and Highway 50 in 1971. The entity now known as Sapp Bros Truck Stops Inc. , was incorporated in October of 1988. Prior to then, the travel centers were each seperate corporations, under the central leadership of W.D.Sapp. Sapp Bros Truck Stops Inc. , has grown into a chain of sixteen travel centers.\r<br />\r<br />\r<b> <span style=""text-decoration: underline""> Job Summary of Cashier </span></b><span style=""text-decoration: underline""> </span>:\r<br />\r<br />\rThe Store Sales Associate/Cashier is responsible for delivering fast and friendly service to our customers.   He or she is required to treat every customer as if they were a Guest in their own home.  A Store Sales Associate needs to have an enthusiastic, passionate desire to deliver outstanding Guest service and always with a smile.\r<br />\r<br />\r<b><span style=""text-decoration: underline"">Duties of Cashier includes:</span></b><span style=""text-decoration: underline""> </span>\r<br />\r<br />\rSapp Bros. is a place where everyone works hard to make each truck stop the very best by being the friendliest and cleanest truck stop chain in the United States.  This is not an easy job, but it is very rewarding to serve the traveling public and trucking industry. We offer many opportunities for career advancement for team members who deliver a??Wowa?? service.  Below is a partial list of duties that one could expect to perform on a typical shift:\r<br />\r<br />\r<ul>\r    <li>Thank every Guest for their business and invite them back\r    <br />\r    <li>Greet every Guest with a smile\r    <br />\r    <li>Check in vendors\r    <br />\r    <li>Bag Ice\r    <br />\r    <li>Build a display\r    <br />\r    <li>Wipe down gas pumps\r    <br />\r    <li>Restock cooler doors and freezer\r    <br />\r    <li>Empty trash containers\r    <br />\r    <li>Sign for gasoline/diesel deliveries\r    <br />\r    <li>Clean rest rooms and showers\r    <br />\r    <li>Pick up outside trash and sweep lot\r    <br />\r    <li>Brew coffee and clean the fountain area\r    <br />\r    <li>Stock shelves\r    <br />\r    <li>Sweep and mop sales area\r    <br />\r    <li>Clear walk ways of snow and spread ice melt\r    <br />\r    <li>Order merchandise and supplies\r    <br />\r    <li>Stock roller grill and deli bar\r    <br />\r    <li>Attend regularly scheduled team meetings</li>\r</ul>"
Financial Analyst,"<p>\tLooking to join an outstanding firm that promotes from within??? Look no further.?? We are seeking a Financial Analyst to join our team, responsibilities include:</p><p>&nbsp;</p><ul>\t<li>\t\tSupport the annual planning cycle and operating plan, and the quarterly budget and ad hoc forecasts.</li></ul><p>&nbsp;</p><ul>\t<li>\t\tEnhance and/or create various models that support the organizational business units - revenue, expenses, and profitability. </li></ul><ul>\t<li>\t\tPrepare and analyze monthly, quarterly, annual, and ad hoc reports for various business reviews tied to scorecards, key initiatives, and business drivers (e.g., assets, flows, competitive/market share, revenue, expense, income, margin).</li></ul><ul>\t<li>\t\tWork closely with department managers to ensure forecasts and reports are accurate and appropriately integrated within consolidated reports and forecasts.</li></ul><ul>\t<li>\t\tThink creatively and drive innovative process improvements in all phases of reporting.</li></ul>"
