Query,JD
Sales Representative,"<p><span>Why settle for an ordinary sales career, when you can put more life in your career with us? <b>Colonial Life </b>has an immediate opening for SALES REPRESENTATIVES to join our growing team.</span></p>\r<p></p>\r<p><span>We are a leader in worksite marketing. We work with employers and their employees to provide benefit solutions in one neat package: benefits communication, enrollment, and personal insurance products.</span></p>\r<p></p>\r<p><b><span>Skills/backgrounds associated with success are:</span></b></p>\r<ol>\r    <li><span>Experience attaining challenging sales goals.</span>\r    <li><span>Ability to identify and prioritize sales opportunities.</span>\r    <li><span>Effective verbal and written communication skills, and??ability to successfully engage all levels of customer base.</span>\r    <li><span>Self-motivation and drive; willing to invest time in developing client relationships.</span> </li>\r</ol>\r<p></p>\r<p><b><span>Career Opportunities:</span></b></p>\r<p></p>\r<ol>\r    <li><span>Prospect, market and deliver benefit communications and enrollment solutions to decision makers.</span>\r    <li><span>Present voluntary product solutions to employees.</span> </li>\r</ol>\r<p></p>\r<p><span><br>\r<b>We provide the tools, training and support to help you succeed. With Colonial Life, you can:</b></span><b></b></p>\r<p><span>?? <b></b></span></p>\r<ol>\r    <li><span>Achieve more than just sales a?? enjoy being a benefits counselor.</span>\r    <li><span>Work with a sound company thata??s had a solid history of integrity and growth for more than 70 years.</span>\r    <li><span>Enjoy strong earnings potential, even in your first year, plus competitive bonuses and incentives. Average first-year income for our top new benefit counselors hit $105,000 last year. </span>\r    <li><span>Grow and refine your skills through our proven phone prospecting system and structured sales training program.</span>\r    <li><span>Enjoy a flexible work schedule.</span>\r    <li><span>Earn what youa??re worth, help people, and have fun doing it!</span> </li>\r</ol>\r<p></p>"
Store Manager,"<strong>Category: </strong> ??Main Store\r\n \r\n Responsible for maximizing the storea??s sales, profit and customer service objectives through the effective management of store teammates. Ensures that store meets all operational and merchandising goals. Models Shopkoa??s commitment to providing exceptional customer service. Provides expertise and leadership direction for all loss prevention programs. MINIMUM KNOWLEDGE, EXPERIENCE & SKILLS REQUIREMENTS:??¡ì Bachelora??s degree in relevant business field or equivalent experience and 3 years of leadership experience in an equivalent big-box retail environment.??¡ì Proven ability to lead, coach and build teammate relationships in an environment of fast change; must be able to direct, and motivate a diverse teammate population.??¡ì Demonstrated ability to analyze and solve problems of varied scope; must be able to act decisively in implementing solutions.??¡ì Strong organizational skills for planning work and continuously monitoring progress towards goals.??¡ì Demonstrated ability to multi-task; ability to respond flexibly in a quickly changing environment.??¡ì Ability to analyze and synthesize financial reports.??¡ì Strong communication skills (both oral and written) for effective management of teams.??¡ì Must demonstrate an exemplary commitment to provide exceptional customer service.??¡ì General knowledge of and ability to operate a personal computer; working knowledge of Excel and Word and a scheduling tool such as Resource Management.ESSENTIAL FUNCTIONS & WORK REQUIREMENTS:??¡ì Must be able to move around the stock room and sales floor for extended periods.??¡ì Requires occasional lifting of up to 50 pounds.??¡ì Must demonstrate physical agility (bending, twisting, reaching, and pulling) for handling merchandise.??¡ì Must be able to plan, organize, execute all Company programs on-time and within the allowed expense guidelines, while teaching and expecting others to do the same.??¡ì Must be available to work early mornings, days, nights and weekends to meet the needs of the stores.These statements are intended to describe the general nature and level of work performed by teammates assigned to this job classification. They are not intended to be an exhaustive list of all responsibilities, duties and skills required.*HJ* *CB*"
Physical Therapist,"<b>\r<hr>\r<p style=""text-align: center"">Physical Therapist </p>\r<hr>\r</b>\r<center><b>* Clinical Excellence* Innovation * Professional Development * Advanced Technology *</b></center><br>\r<strong><span style=""text-decoration: underline"">Why work at Amedisys?</span></strong>\r<ul>\r    <li>Competitive salaries and strong benefits for you and your family including a 401(k) retirement account, health care benefits and paid vacation time.\r    <li>We believe that our people are our business. Amedisys invests in you throughout your career with us including a Career Ladders program and Lifelong Learning educational opportunities.\r    <li>Working for Amedisys you will be a part of a culture that is focused on doing the right thing, at the right time, for every patient. </li>\r</ul>\r<br>\r<strong><span style=""text-decoration: underline"">About Us</span></strong><br>\r<br>\r<strong>Dream big. Think outside the box. See the possibilities. Offer creative solutions. Amedisys listens.</strong><br>\r<br>\r<strong>Amedisys Home Health Services</strong> is a leading provider of home health and hospice services. As a national company, we have a far reach and have positioned ourselves as an industry leader in quality care and as the company that is reducing acute care hospitalization.<br>\r<br>\r<strong>As our growth rapidly continues, we are seeking dynamic employees to aide in our mission:</strong>\r<ul>\r    <li>To improve the quality of life in the patients entrusted to our care.\r    <li>To be the premier home health company in the communities we serve. </li>\r</ul>\r<br>\r<p><strong><span style=""text-decoration: underline"">Responsibilities of Physical Therapist:<br>\r<br>\r</span></strong></p>\r<ul>\r    <li>Evaluate and treat patients using the most current technology and practices\r    <li>Provide valuable input into the patienta??s care and treatment\r    <li>Gain quality experience in working with a multi-disciplinary team and personal patient interaction\r    <li>Spend more time working with patients and make a significant difference in their lives </li>\r</ul>"
Receptionist,Description:<br>\r<br>\rFast Paced Specialized?? for a property management company in West Palm Beach is looking for a determined dynamic person that will be responsible for:<br>\r<br>\r- answering a multi-line phone system<br>\r- will interact with cilents via phone and in person<br>\r-?? taking payments from clients
Project Manager,"<b>Responsibilities:</b> Assuming this role, the selected candidate will have the following responsibilities:\r\n<ul><li>Design, plan, and coordinate work teams</li>\r\n<li>Follow standard project management industry practices such as the PMI's framework</li>\r\n<li>Understand business and technical objectives of a project and work closely with the project sponsor</li>\r\n<li>Create project charter and work plan and track budget and schedule progress via appropriate metrics</li>\r\n<li>Establish project organization and methodologies and define roles and responsibilities</li>\r\n<li>Document risks and develop mitigation plans</li>\r\n<li>Manage scope</li>\r\n<li>Create and implement a communication plan</li>\r\n<li>Build an effective team; assign tasks to team members, and evaluate outcomes</li>\r\n<li>Negotiate resources</li>\r\n<li>Communicate to stakeholders and project sponsor</li>\r\n<li>Identify, track, and ensure resolution of issues and removal of barriers</li>\r\n<li>Provide technical support to project team members</li>\r\n<li>Handle complex application features and technical designs</li>\r\n<li>Design and implement the components required for complex application features</li>\r\n<li>Generally manage a group of Applications Systems Analysts</li>\r\n<li>Rely on experience and judgment to plan and accomplish goals</li>\r\n</ul>\r\n\r\nKforce (Nasdaq:KFRC) is a professional staffing and solutions firm providing flexible and permanent staffing solutions in the skill areas of technology, finance & accounting, clinical research and healthcare. Backed by approximately our associates and consultants on assignment, Kforce is committed to ""Great People = Great Results"" for our valued clients and candidates. Kforce operates with 65 offices located throughout the United States and two offices in the Philippines.\r\n\r\nJob Ref#: 2312~EQG~1138834T1~99"
Java Developer,"<b>Responsibilities:</b> Our client, located in Lake Oswego, Oregon, is seeking a Java Developer of Web based services.\r\n\r\nMain Duties:\r\n<UL><LI>Development experience in Oracle a plus</li>\r\n<li>Translates detailed design into web services</li>\r\n<li>Supports testing, debugging, and refining the computer software to produce the required product</li>\r\n<li>Helps prepare both program-level and user-level documentation</li>\r\n</ul>\r\n\r\nKforce (Nasdaq:KFRC) is a professional staffing and solutions firm providing flexible and permanent staffing solutions in the skill areas of technology, finance & accounting, clinical research and healthcare. Backed by approximately our associates and consultants on assignment, Kforce is committed to ""Great People = Great Results"" for our valued clients and candidates. Kforce operates with 65 offices located throughout the United States and two offices in the Philippines.\r\n\r\nJob Ref#: 2312~WQG~1140469T1~99"
Cashier,"Job Description\r\nWe are looking for knowledgeable and energetic people who want to sell automotive parts.?? \r\n\r\nAre you ready for <STRONG>OPPORTUNITIES</STRONG> to grow your career?\r\nDo you need <STRONG>FLEXIBITY</STRONG> in your schedule?\r\nWant to have <STRONG>FUN</STRONG> in your job?\r\nLooking for a <STRONG>GREAT TEAM</STRONG> to work with?\r\n\r\nAre you ready to sell <STRONG>The Good Stuff</STRONG>?\r\n\r\nJoin the winning team at your local NAPA Store:??\r\n\r\nAssisting customers with their auto parts purchase \r\nOperating a cash register, computer and paper cataloging systems and processing daily paperwork and forms.\r\nDemonstrate a positive, helpful attitude as well as presenting professional conduct and appearance at all times.\r\nAdhering to company policies and procedures."
Receptionist,"<ul>\r    ????????<span>??\r    <li><span>Operate switchboard and paging system.</span></li>\r    <li><span>Receive and direct visitors.</span></li>\r    <li><span>Maintain registers of visitors and applicants for employment.</span></li>\r    <li><span>Assist applicants for employment by issuing applications, job descriptions and referring them to the appropriate supervisor for an interview.</span></li>\r    <li><span>Responsible for inputting requests for Room Reservations and distributing the appropriate requests for food and room set-up and submitting a confirmation to the requesting party.</span></li>\r    <li><span>Assist administrative support staff with clerical tasks as assigned.</span></li>\r    <li><span>Meter, sort and distribute incoming, outgoing and inter-office mail; take mail to post office as requested.?????????????????? </span></li>\r    <li><span>Order supplies for the administration building, coffee room and turn off coffee machine prior to going off shift and assist in preparing coffee throughout each workday.</span></li>\r    <li><span>Maintain the neat appearance of the Administration lobby.</span></li>\r    <li><span>Responsible for maintaining postage meter, i.g. checking on postage meter weekly.</span></li>\r    <li><span>Responsible for sorting and distributing the office supplies.</span></li>\r    <li><span>Responsible for distributing all incoming faxes.</span></li>\r    <li><span>Check paper and toner in copy and fax machines on a daily basis.</span></li>\r    <li><span>Perform other related duties as assigned.</span></li>\r    <li><span>Other related duties as needed. </span></li>\r    </span>\r</ul>"
Physical Therapist,"As Mercy continues to grow, we are in need of qualified Physical Therapists who will provide professional physical therapy services to the organizationa??s clients as prescribed by the physician, and in compliance with the statea??s professional practice act for physical therapy, any applicable licensure/certification requirements, and the organizationa??s policies and procedures."
Receptionist,"<div>\r<p><span>Busy Northshore??Plastic Surgery/Medical Spa in Kenilworth, IL is seeking a highly motivated, enthusiastic, self-starting individual to fulfill the role of Receptionist.<br>\r??<br>\rThe environment is challenging and fast-paced. Candidates should be outgoing, positive, quick thinking, demonstrate the ability to navigate the needs of numerous patients, be able to multi-task, possess detailed knowledge of plastic surgery, spa procedures and products as well as demonstrate some level of proficiency in sales. </span></p>\r<p><span>??</span></p>\r<p><span>This position has potential to expand for the right candidate. </span></p>\r<p><span>??</span></p>\r<p><span>To apply, please email cover letter and resume.</span></p>\r<p><span>??</span></p>\r<p><span>??</span></p>\r</div>"
Maintenance Technician,"<DIV>\r<P style=""MARGIN: 0pt 49.8pt 0pt 63pt; TEXT-ALIGN: center""><SPAN style=""FONT-WEIGHT: bold"">??</SPAN>??</P>\r<P style=""MARGIN: 0pt 72pt; TEXT-ALIGN: center""><SPAN style=""FONT-WEIGHT: bold"">??</SPAN>??</P>\r<P style=""MARGIN: 0pt 72pt; TEXT-ALIGN: center""><SPAN style=""FONT-WEIGHT: bold"">??</SPAN>??</P>\r<P style=""MARGIN: 0pt 72pt; TEXT-ALIGN: center""><SPAN style=""FONT-WEIGHT: bold"">??</SPAN>??</P>\r<P style=""MARGIN: 0pt 72pt; TEXT-ALIGN: center""><SPAN style=""FONT-WEIGHT: bold"">??</SPAN>??</P>\r<P style=""MARGIN: 0pt 72pt; TEXT-ALIGN: center""><SPAN style=""FONT-WEIGHT: bold"">Webasto Roof Systems, Inc.</SPAN></P>\r<P style=""MARGIN: 0pt 72pt; TEXT-ALIGN: center""><SPAN style=""FONT-WEIGHT: bold; FONT-STYLE: normal"">2</SPAN><SPAN style=""FONT-WEIGHT: bold; VERTICAL-ALIGN: super; FONT-STYLE: normal"">nd</SPAN><SPAN style=""FONT-WEIGHT: bold; FONT-STYLE: normal""> Shift </SPAN></P>\r<P style=""MARGIN: 0pt 72pt; TEXT-ALIGN: center""><SPAN style=""FONT-WEIGHT: bold; FONT-STYLE: normal"">Maintenance Technician</SPAN></P>\r<P style=""MARGIN: 0pt 72pt""><SPAN style=""FONT-STYLE: normal"">??</SPAN>??</P>\r<P style=""MARGIN: 0pt 72pt""><SPAN style=""FONT-WEIGHT: bold; FONT-STYLE: normal"">Qualifications:</SPAN></P>\r<P style=""MARGIN: 0pt 72pt 0pt 90pt""><SPAN style=""FONT-WEIGHT: bold; FONT-STYLE: normal"">Manufacturing Maintenance</SPAN></P>\r<P style=""MARGIN: 0pt 72pt 0pt 90pt""><SPAN style=""FONT-WEIGHT: bold; FONT-STYLE: normal"">Mechanical/Electrical Troubleshooting</SPAN></P>\r<P style=""MARGIN: 0pt 72pt 0pt 90pt""><SPAN style=""FONT-WEIGHT: bold; FONT-STYLE: normal"">Hydraulic/Pneumatic experience</SPAN></P>\r<P style=""MARGIN: 0pt 72pt 0pt 90pt""><SPAN style=""FONT-WEIGHT: bold; FONT-STYLE: normal"">ABB and Fanuc Robot experience</SPAN></P>\r<P style=""MARGIN: 0pt 72pt""><SPAN style=""FONT-WEIGHT: bold; FONT-STYLE: normal"">Desirable Skills: Welding and Electricians license</SPAN></P>\r<P style=""MARGIN: 0pt 72pt""><SPAN style=""FONT-STYLE: normal"">??</SPAN>??</P>\r<P style=""MARGIN: 0pt 72pt; TEXT-ALIGN: center""><SPAN style=""FONT-STYLE: normal"">Webasto</SPAN></P>\r<P style=""MARGIN: 0pt 72pt; TEXT-ALIGN: center""><SPAN style=""FONT-STYLE: normal"">Human Resources</SPAN></P>\r<P style=""MARGIN: 0pt 72pt; TEXT-ALIGN: center""><SPAN style=""FONT-STYLE: normal"">2220 Innovation Drive??</SPAN></P>\r<P style=""MARGIN: 0pt 72pt""><SPAN style=""FONT-STYLE: normal"">Lexington, KY 40511</SPAN></P>\r<P style=""MARGIN: 0pt 72pt; TEXT-ALIGN: center""><SPAN style=""FONT-STYLE: normal"">??</SPAN>??</P>\r<P style=""MARGIN: 0pt 72pt; TEXT-ALIGN: center""><SPAN style=""FONT-STYLE: normal"">An Equal Opportunity Employer</SPAN></P>\r<P style=""MARGIN: 0pt 72pt; TEXT-ALIGN: center""><SPAN style=""FONT-STYLE: normal"">Must pass pre-employment physical, drug screen, and background check.</SPAN></P>\r<P style=""MARGIN: 0pt""><SPAN>??</SPAN>??</P>\r</DIV>"
Financial Analyst,"<b>Responsibilities:</b> Our client in the healthcare industry is seeking a Senior Financial Analyst. This person will be reporting to the Manager of FP&A and will have exposure to many different areas of the company. This individual will be conducting analysis on their product lines, assisting in budgeting and forecasting and completing ad-hoc projects for management.\r\n\r\nKforce (Nasdaq:KFRC) is a professional staffing and solutions firm providing flexible and permanent staffing solutions in the skill areas of technology, finance & accounting, clinical research and healthcare. Backed by approximately our associates and consultants on assignment, Kforce is committed to ""Great People = Great Results"" for our valued clients and candidates. Kforce operates with 65 offices located throughout the United States and two offices in the Philippines.\r\n\r\nJob Ref#: 2312~WQG~1142358T1~99"
Physical Therapist,"<b>Solvere </b>has an exciting and challenging opportunity for an experienced&nbsp;<b>Physical Therapist </b>located in <strong>Soledad, California</strong>. That's just 1/2 hour from the beach town of Salinas, California!<br>\r<p>&nbsp;</p>\r<p><strong><span style=""text-decoration: underline"">Must have at least 1 year working experience under License</span></strong></p>\r<p>&nbsp;</p>\r<p><strong>Excellent Pay - $48 per hour<br>\rShifts- 3-5 days a week - 8 hour shifts</strong></p>\r<p><strong>Referral bonuses and Direct Deposit<br>\r</strong><br>\r<b><span style=""text-decoration: underline"">Physical Therapist responsibilities:</span><br>\r</b>Head and neck, hand, musculoskeletal, orthopedics, sports injuries, occupational medicine, and geriatrics.<br>\r<br>\r<span style=""text-decoration: underline""><strong>Why consider a Physical Therapist&nbsp;temporary assignment? <br>\r</strong></span></p>\r<ul>\r    <li><span>Independence and Flexibility </span>\r    <li><span>Work where you want, when you want! </span>\r    <li><span>Improve the quality of patient care </span>\r    <li><span>Increase your knowledge and experience through a wide range of challenging and exciting short-term opportunities in different locations nationwide </span>\r    <li><span>Enhanced clinical, organizational, and interpersonal skills </span>\r    <li><span>Exposure to a variety of clinicians, equipment, procedures, and practice settings </span>\r    <li><span>Rewarding encounters with diverse population groups </span>\r    <li><span>Sample different practice environments to help formulate personal and professional preferences</span>\r    <li><span>Payments made weekly; on-time&hellip;..every time! </span></li>\r</ul>"
Sales Representative,"<P>Handi-Clean Products, Inc. is a very well known manufacturer of cleaning and maintenance chemical specialties with its' offices and manufacturing facilities located in Greensboro, NC. We are seeking a dynamic sales professional to call on commercial, industrial, and institutional accounts in the Danville-Lynchburg??and surrounding area.</P>\r<P>??</P>\r<P>If you qualify to join our sales team, you will benefit from established accounts and have the opportunity to expand your account base by bringing in new business, therefore, you will enjoy unlimited earnings potential. This is a recession-proof industry. We offer a comprehensive employee benefits package including medical/dental, life insurance, 401k, and etc. Base draw against a lucrative commission structure.</P>"
Java Developer,"<p>&nbsp;</p>\r<ul>\r    <li>Leads analysis, design, development, testing, integration, debugging, documenting and implementation of new and enhancement projects. </li>\r    <li>Produces technical project requirements; designs, documents and conveys solutions.?? </li>\r    <li>Incorporates architectural strategies and standards into their solutions. </li>\r    <li>Promotes project success through efficient designs, programming techniques and strategies, utilizing reuse where practical. </li>\r    <li>Designs and executes unit and integration test strategies to ensure thorough testing prior to QA turnover.?? </li>\r    <li>Leads development and execution of implementation plans and release management processes with all necessary groups. </li>\r    <li>Ensures all technical and project artifacts are complete and properly managed as required per the SDLC. </li>\r    <li>Adheres to established company development standards and spearheads appropriate modifications to improve quality and productivity of the development teams</li>\r    <li>Ensures that all team members follow development standards</li>\r    <li>Works independently and collaboratively to ensure projects deliver high quality, well-written and efficient application components/programs</li>\r    <li>Formulates high level and detailed estimates for blue sky analyses, project planning, and impact assessments including clear justification in situations that may involve ambiguous or unclear requirement</li>\r    <li>Leads technical project teams, anticipating and resolving issues to meet deadlines</li>\r    <li>Plans, organizes and tracks technical project deliverables to adhere to project schedules</li>\r    <li>Current in programming techniques, technologies and tools </li>\r    <li>Keeps abreast of emerging technologies and proposes/implements feasible solutions to improve efficiencies </li>\r    <li>Leads efforts to integrate design strategies, application specifications, development schedules, and user expectations into appropriate project artifacts</li>\r    <li>Effectively leads cross-functional teams, models team qualities, builds team rapport and keeps others informed</li>\r    <li>Excellent written and oral communication skills with diverse audiences</li>\r    <li>Proactively interfaces with others and identifies options to achieve project success</li>\r    <li>Establishes positive relationships with peers across the company to ensure meeting project objectives</li>\r    <li>Takes ownership of technical issues anticipating and mitigating risks, escalating issues appropriately and keeping all necessary parties informed</li>\r    <li>Shares technical, procedural and business knowledge with others</li>\r    <li>Proactively presents information in public forums to share knowledge and improve the productivity of others.?? </li>\r    <li>Mentors others</li>\r</ul>"
Senior Accountant,"<b>Responsibilities:</b> Our client in the real estate industry is seeking a senior accountant to join their team.\r\n\r\nMain Duties:\r\n<UL><LI>Administer, reconcile, and record investment and equity activity</li>\r\n<li>Create and manage various accounting and financial models in Excel</li>\r\n<li>Compile various financial reports</li>\r\n<li>Prepare journal entries and maintain general ledger</li>\r\n<li>Assist with budgets and forecasts</li>\r\n<li>Assist with special analyses and projects</li>\r\n</ul>\r\n\r\nKforce (Nasdaq:KFRC) is a professional staffing and solutions firm providing flexible and permanent staffing solutions in the skill areas of technology, finance & accounting, clinical research and healthcare. Backed by approximately our associates and consultants on assignment, Kforce is committed to ""Great People = Great Results"" for our valued clients and candidates. Kforce operates with 65 offices located throughout the United States and two offices in the Philippines.\r\n\r\nJob Ref#: 2312~WQG~1135671P1~99"
Financial Analyst,"<P style=""MARGIN-TOP: 0px; MARGIN-BOTTOM: 0px"">Several top-notch organizations within the Downtown Los Angeles area are looking for Financial Analysts!!</P>\r\n<P style=""MARGIN-TOP: 0px; MARGIN-BOTTOM: 0px"">??</P>\r\n<P style=""MARGIN-TOP: 0px; MARGIN-BOTTOM: 0px"">Do you have advanced level Excel skills, a four-year degree in Finance and/or Accounting,??and a knack for numbers?? If so, please submit your resume for IMMEDIATE consideration!!!</P>"
